{"schema_version":4,"binding_kind":"run","artifact_version":1,"supersedes_digest":null,"run_purpose":"synthetic_acceptance","registration_id":"m15-core-comparisons-v1","registration_digest":"sha256:2e237046ed5bffed7a2c34131751c9dd64359e5115db0ec21ba92d505eb2fbed","implementation_binding_digest":"sha256:ca323c4ea0de1e5cbb2219ad67f0d5e0bd56b3faf3dc57ab3d991b202042d2d7","schedule_digest":"sha256:a218909f16e10d7594fe15f9a4487d9ebe4ce984f48afbddd4a7c5b932a196d6","budget_profile_digest":"sha256:ce828db56cdcfcc8610fb0754632be2bcdc6f0675195da399da6ed57a23dc859","runtime_environment_digest":"sha256:5a53e86eb07849aa0719ffe14e673668f64f6b7cbd28472239c1a97da01be200","ruleset_digest":"sha256:3b4e0886191a02dc8a8a81818da5805136cd29cacf5588a7cf581f100215089b","calibration_evidence_digest":null,"synthetic_fixture_manifest_digest":"sha256:7726256690dbb715f62051c3d131e7193971d7b174294983fb7069ad017c2ed2","binding_id":"heuristic_v0-m15-synthetic-run-p2","schedule_row_id":"sha256:078f2ea940144047f6b079882b5b6cc5b3c41088f05f4ad0599507cd2c6b24af","seed_family_digest":"sha256:da534c7a2f1ae6b7861db21224b5a360a2669b9690a1181d6c394f949ed26c4e"}
