{"schema_version":4,"binding_kind":"run","artifact_version":1,"supersedes_digest":null,"run_purpose":"synthetic_acceptance","registration_id":"m15-core-comparisons-v1","registration_digest":"sha256:c05cbeb123bcc797d325807a739402266ccdaf0c8e4de9691764af012a3ad03b","implementation_binding_digest":"sha256:56db0a62df44fe708397c5e55f3cff1f17b599f6067bf9ec54846aba4b90ec78","schedule_digest":"sha256:a218909f16e10d7594fe15f9a4487d9ebe4ce984f48afbddd4a7c5b932a196d6","budget_profile_digest":"sha256:674418905e2ee252570a0ec192a33ad0325116b8978c9a3cce46548d4fcebaa7","runtime_environment_digest":"sha256:5a53e86eb07849aa0719ffe14e673668f64f6b7cbd28472239c1a97da01be200","ruleset_digest":"sha256:3b4e0886191a02dc8a8a81818da5805136cd29cacf5588a7cf581f100215089b","calibration_evidence_digest":null,"synthetic_fixture_manifest_digest":"sha256:10c90ba770cb6b6b4e8c631727463c4356ae20169db796d6f47ed05e4bcb7ce8","binding_id":"heuristic_v0-m15-synthetic-run-p1","schedule_row_id":"sha256:998ad3d52772d251c89dd65ae07b5aae73078b0570e80cefb68eb09af17f5e3c","seed_family_digest":"sha256:d179b65a12dda5442e375b0fb3475d2738f8795d06bc07429819b8ad8e35814b"}
